DDC,title,description
478,501 Latin Verbs,"Learning Latin is easy with Barron's 501 Latin Verbs. The authors provide clear, easy-to-use review of the most important and commonly used verbs from the Latin language. Each verb is listed alphabetically in easy-to-follow chart form—one verb per page with its English translation.This comprehensive verb guide is ideal for Latin students or anyone interested in learning Latin. It includes: 501 of the most common Latin verbs, conjugated in all tensesConcise guide to Latin verb conjugationHundreds of examples demonstrating verb usageLatin conjugation exercises and answersA list of Essential 55 Verbs with usage examples and expressions related to the verbsOverview of Latin grammarIndex of English-Latin verbs"
478,Latin: An Intensive Course,"This is a comprehensive introduction to Latin forms and syntax, designed to train the student in reading ancient texts at an early stage."
478,The Boys Start the War,"The first book in the hilarious trilogy featuring the feuding Hatford and Malloy families. When a new family--with three daughters--moves into the neighborhood, the Hatford brothers decide to make Caroline and her sisters so miserable that they'll want to go back to Ohio."
478,Getting Started with Latin,"What's preventing you from teaching Latin in your homeschool or learning it on your own? If you're intimidated because you've never studied Latin, bewildered by traditional Latin books that move too fast, or just don't know where to begin, then Getting Started with Latin is for you! Specifically designed to overcome these types of obstacles, Getting Started with Latin is divided into simple lessons that explain the fundamentals of Latin grammar in a way that anyone can grasp. Instead of burying you in mountains of information to memorize, new words and concepts are introduced in a gradual and systematic way. You can immediately apply what you've learned by translating the fun exercises at the end of each lesson. Quickly check your work by turning to the included answer key. To hear the words pronounced, simply download the free recordings from www.GettingStartedWithLatin.com. For additional help and instruction, the author has provided extensive audio commentary recordings that teach through every lesson and exercise in the book. With everything you need here in one book, why aren't you Getting Started with Latin?"
478,"How to insult, abuse & insinuate in classical Latin","When your contempt has reached classical proportions, crude Anglo-Saxon expletives just won't cut the mustard. Learn to express your outrage in the words of such late, great Romans as Horace, Cicero, Virgil, and Ovid -- guys who could ""dis"" with class! Unapologetically quoting these famous Latin writers entirely out of context, the authors have compiled a witty, wicked little lexicon of insults and invective that will soon have you demeaning, defaming, and degrading your enemies with real ""animus."" 6 1/2"" x 7 1/4"". Black-and-white illustrations."
478,The Mouse of Amherst,"When a mouse named Emmaline takes up residence behind the wainscoting of Emily Dickinson's bedroom, she wonders what it is that keeps Emily scribbling at her writing table throughout the day and into the night. Emmaline sneaks a look, and finds that it's poetry! Inspired, Emmaline writes her own first poem and secretly deposits it on Emily's desk. Emily answers with another poem, and a lively exchange begins. In this charming and fanciful introduction to Emily Dickinson, Elizabeth Spires demonstrates the power of poetry to express our deepest feelings, while Claire A. Nivola's delicate pencil drawings capture the intricacies of life in Emily's world. Included are eight of Dickinson's most loved poems, with seven corresponding poems by Emmaline that are sure to bring out the poet in any child."
478,These Hands,"Joseph's grandpa could do almost anything with his hands. He could play the piano, throw a curveball, and tie a triple bowline knot in three seconds flat. But in the 1950s and 60s, he could not bake bread at the Wonder Bread factory. Factory bosses said white people would not want to eat bread touched by the hands of the African Americans who worked there. In this powerful intergenerational story, Joseph learns that people joined their hands together to fight discrimination so that one day, their hands—Joseph's hands—could do anything at all in this whole wide world."
478,Latin For Dummies,"This title provides complete coverage of all Latin language essentials including grammar, usage and vocabulary to have readers reading and speaking Latin in no time. There are many examples to give readers language skills they can use immediately, no matter what their reason for studying."
