DDC,Title,description
874,The Student's Catullus,"Although his audacious, erotic, and satirical verses survived the Middle Ages in only a single copy, Catullus has in our time become a standard author in the college Latin curriculum, ranking with Virgil, Horace, and Ovid. In this third edition, thoroughly revised, Daniel H. Garrison makes these famous poems more accessible than ever to students of Latin. A standard college textbook as well as a comprehensive reference, the book includes a brief introduction about the poet's life and the character of his poems, a fresh recension of all 113 poems, and a commentary in English on each poem, explaining difficult points of Latin, features of Catullus' artistry, and background information. The notes to each poem also illuminate the meaning of Catullus' language, with explanations of word choice, word order, sound effects, and meter. Additional aids to the reader are a Who's Who of the most important people in Catullus' poems, an introduction to Catullan meters, a glossary of literary terms used in the commentary, a complete Latin-English Catullan vocabulary, and six maps. Rather than promoting specific literary judgments or theories, The Student's Catullus provides readers of this important Latin poet with the information necessary to read the poet's own language intelligently and to make fresh appraisals of their own."
626,Through the locks: Canals today and yesterday,Brief history of several canals and locks including the Erie and Panama.
498,Kuna Ways of Speaking: An Ethnographic Perspective (Texas Linguistics Series),"For the Kuna, a nonindustrial people of the South American tropical forest, the world is perceived, conceived, organized, & controlled by oral speech & language. Thus, by exploring their ways of speaking, Joel Sherzer provides valuable insights into the nature of Kuna social & political organization, world view, religion, economics, medicine, & aesthetics. This unique work encompasses the full range of speech, from the dominant areas of ritual life-magic & curing, puberty rites, & politics-to everyday conversation, gossip, narration, & greeting & leave-taking."
480,Froggy's Best Babysitter,"Froggy's parents are going out for the night and they've left him with a brand-new babysitter! Froggy tries to help out by feeding his little sister and taking a bath on his own, but only Froggy could create havoc in the kitchen and turn bath time into mess time. Will the new babysitter survive his wellmeant antics until Froggy's parents get home?"
397,No Biggie: Autism In the Early Childhood Classroom,"It's No Biggie: Autism in the Early Childhood Classroom is designed as an introduction for preschool teachers, childcare workers and others working with young children to best practices in working with all children, but most notably with those on the autism spectrum. The book contains background information on effective early childhood practices, with an emphasis on students who are or may be on the autism spectrum. The very knowledgeable and experienced authors present an overview of autism, specific strategies for the classroom teacher now dealing with those on the autism spectrum, as well as interesting and insightful vignettes that bring these strategies to life. Chapters on the special education process, working with parents and with other professionals, and facing the challenges presented in working with young special needs children provide practical suggestions for both experienced educators, and those new to the world of special education."
199,"Body, Community, Language, World","Patocka, like few others before or since, combined what was best in Husserl and Heidegger, but at the same time found for himself a distinct, original philosophical voice. Both his originality and his synthesis of the two dominant strands of classical phenomenology are evident here, as Patocka pursues the threefold theme of subject body, human community, and the phenomenological understanding of ""world."" This volume is an excellent introduction to philosophy in the phenomenological tradition."
879,Marvels of the East: A Full Reproduction of the Three Known Copies,"This volume reproduces all three surviving manuscript versions of Marvels of the East, a medieval text describing extraordinary peoples, animals, and wonders believed to exist in distant regions of Asia and Africa. Edited by M. R. James, the work is valuable for the study of medieval geography, mythology, travel literature, and manuscript illustration traditions."
879,An Anthology of Medieval Latin,"An Anthology of Medieval Latin is a carefully selected collection of Medieval Latin texts chosen by scholar Stephen Gaselee. Covering a wide range of authors and periods, the anthology introduces readers to the literary, religious, historical, and intellectual traditions of medieval Europe. The selections highlight both the continuity of classical Latin and the distinctive characteristics of medieval Latin literature."
